Documentation

12/28/2024:
    Hardware setup:
        Arducam Camera attatched to Raspberry Pi 5.

    Software setup:
        Running files as modules. Using virtual environment (myenv).


Lines [API/Camera/find_camera -> FindCamera -> __find_cams()]:
    devices = usb.core.find(find_all=True, custom_match=find_class(14))
    print(f"[DEBUG FindCamera] Devices found : {devices}")

Output:
    [DEBUG FindCamera] Devices found : <generator object find.<locals>.device_iter at 0x7fffaa0c9940>



Lines [API/Camera/find_camera -> FindCamera -> __find_cams()]:
    v4ctl = subprocess.check_output("v4l2-ctl --list-devices", shell=True).decode("utf-8")
    v4ctl = v4ctl.split("\n")
    print(f"[DEBUG FindCamera] v4ctl after split : {v4ctl}")

Output:
    [DEBUG FindCamera] v4ctl after split : ['pispbe (platform:1000880000.pisp_be):', '\t/dev/video20', '\t/dev/video21', 
    '\t/dev/video22', '\t/dev/video23', '\t/dev/video24', '\t/dev/video25', '\t/dev/video26', '\t/dev/video27', '\t/dev/video28', 
    '\t/dev/video29', '\t/dev/video30', '\t/dev/video31', '\t/dev/video32', '\t/dev/video33', '\t/dev/video34', '\t/dev/video35', 
    '\t/dev/media0', '\t/dev/media2', '', 'rpivid (platform:rpivid):', '\t/dev/video19', '\t/dev/media1', '', 
    'Arducam USB Camera: Arducam USB (usb-xhci-hcd.1-2):', '\t/dev/video0', '\t/dev/video1', '\t/dev/video2', '\t/dev/video3', 
    '\t/dev/media3', '', '']

Lines:
    output = subprocess.check_output(f'lsusb -tvv | grep /dev/bus/usb/{device.bus:03}/{device.address:03}', shell=True).decode("utf-8")
    id = output.split("\n")[0].strip().split(" ")[0].split("1-", 1)[-1]

    print(f"[DEBUG FindCamera] Output : {output}, id: {id}, device: {device}")
    print(f"[DEBUG FindCamera] Length of v4ctl : {len(v4ctl)}")
    print(f"[DEBUG FindCamera] ID: {id}") 

Output:
    [DEBUG FindCamera] Output :         /sys/bus/usb/devices/3-2  /dev/bus/usb/003/006
            /sys/bus/usb/devices/3-2  /dev/bus/usb/003/006
            /sys/bus/usb/devices/3-2  /dev/bus/usb/003/006
            /sys/bus/usb/devices/3-2  /dev/bus/usb/003/006
            /sys/bus/usb/devices/3-2  /dev/bus/usb/003/006
    , id: /sys/bus/usb/devices/3-2, device: DEVICE ID 0c45:6366 on Bus 003 Address 006 =================
    bLength                :   0x12 (18 bytes)
    bDescriptorType        :    0x1 Device
    bcdUSB                 :  0x200 USB 2.0
    bDeviceClass           :   0xef Miscellaneous
    bDeviceSubClass        :    0x2
    bDeviceProtocol        :    0x1
    bMaxPacketSize0        :   0x40 (64 bytes)
    idVendor               : 0x0c45
    idProduct              : 0x6366
    bcdDevice              :  0x100 Device 1.0
    iManufacturer          :    0x2 Error Accessing String
    iProduct               :    0x1 Error Accessing String
    iSerialNumber          :    0x3 Error Accessing String
    bNumConfigurations     :    0x1
    CONFIGURATION 1: 500 mA ==================================
    bLength              :    0x9 (9 bytes)
    bDescriptorType      :    0x2 Configuration
    wTotalLength         :  0x43e (1086 bytes)
    bNumInterfaces       :    0x5
    bConfigurationValue  :    0x1
    iConfiguration       :    0x0 
    bmAttributes         :   0x80 Bus Powered
    bMaxPower            :   0xfa (500 mA)
        INTERFACE 0: Video =====================================
        bLength            :    0x9 (9 bytes)
        bDescriptorType    :    0x4 Interface
        bInterfaceNumber   :    0x0
        bAlternateSetting  :    0x0
        bNumEndpoints      :    0x1
        bInterfaceClass    :    0xe Video
        bInterfaceSubClass :    0x1
        bInterfaceProtocol :    0x0
        iInterface         :    0x5 Error Accessing String
        ENDPOINT 0x83: Interrupt IN ==========================
        bLength          :    0x7 (7 bytes)
        bDescriptorType  :    0x5 Endpoint
        bEndpointAddress :   0x83 IN
        bmAttributes     :    0x3 Interrupt
        wMaxPacketSize   :   0x10 (16 bytes)
        bInterval        :    0x6
        INTERFACE 1: Video =====================================
        bLength            :    0x9 (9 bytes)
        bDescriptorType    :    0x4 Interface
        bInterfaceNumber   :    0x1
        bAlternateSetting  :    0x0
        bNumEndpoints      :    0x0
        bInterfaceClass    :    0xe Video
        bInterfaceSubClass :    0x2
        bInterfaceProtocol :    0x0
        iInterface         :    0x0 
        INTERFACE 1, 1: Video ==================================
        bLength            :    0x9 (9 bytes)
        bDescriptorType    :    0x4 Interface
        bInterfaceNumber   :    0x1
        bAlternateSetting  :    0x1
        bNumEndpoints      :    0x1
        bInterfaceClass    :    0xe Video
        bInterfaceSubClass :    0x2
        bInterfaceProtocol :    0x0
        iInterface         :    0x0 
        ENDPOINT 0x81: Isochronous IN ========================
        bLength          :    0x7 (7 bytes)
        bDescriptorType  :    0x5 Endpoint
        bEndpointAddress :   0x81 IN
        bmAttributes     :    0x5 Isochronous
        wMaxPacketSize   :   0x80 (128 bytes)
        bInterval        :    0x1
        INTERFACE 1, 2: Video ==================================
        bLength            :    0x9 (9 bytes)
        bDescriptorType    :    0x4 Interface
        bInterfaceNumber   :    0x1
        bAlternateSetting  :    0x2
        bNumEndpoints      :    0x1
        bInterfaceClass    :    0xe Video
        bInterfaceSubClass :    0x2
        bInterfaceProtocol :    0x0
        iInterface         :    0x0 
        ENDPOINT 0x81: Isochronous IN ========================
        bLength          :    0x7 (7 bytes)
        bDescriptorType  :    0x5 Endpoint
        bEndpointAddress :   0x81 IN
        bmAttributes     :    0x5 Isochronous
        wMaxPacketSize   :  0x100 (256 bytes)
        bInterval        :    0x1
        INTERFACE 1, 3: Video ==================================
        bLength            :    0x9 (9 bytes)
        bDescriptorType    :    0x4 Interface
        bInterfaceNumber   :    0x1
        bAlternateSetting  :    0x3
        bNumEndpoints      :    0x1
        bInterfaceClass    :    0xe Video
        bInterfaceSubClass :    0x2
        bInterfaceProtocol :    0x0
        iInterface         :    0x0 
        ENDPOINT 0x81: Isochronous IN ========================
        bLength          :    0x7 (7 bytes)
        bDescriptorType  :    0x5 Endpoint
        bEndpointAddress :   0x81 IN
        bmAttributes     :    0x5 Isochronous
        wMaxPacketSize   :  0x320 (800 bytes)
        bInterval        :    0x1
        INTERFACE 1, 4: Video ==================================
        bLength            :    0x9 (9 bytes)
        bDescriptorType    :    0x4 Interface
        bInterfaceNumber   :    0x1
        bAlternateSetting  :    0x4
        bNumEndpoints      :    0x1
        bInterfaceClass    :    0xe Video
        bInterfaceSubClass :    0x2
        bInterfaceProtocol :    0x0
        iInterface         :    0x0 
        ENDPOINT 0x81: Isochronous IN ========================
        bLength          :    0x7 (7 bytes)
        bDescriptorType  :    0x5 Endpoint
        bEndpointAddress :   0x81 IN
        bmAttributes     :    0x5 Isochronous
        wMaxPacketSize   :  0xb20 (2848 bytes)
        bInterval        :    0x1
        INTERFACE 1, 5: Video ==================================
        bLength            :    0x9 (9 bytes)
        bDescriptorType    :    0x4 Interface
        bInterfaceNumber   :    0x1
        bAlternateSetting  :    0x5
        bNumEndpoints      :    0x1
        bInterfaceClass    :    0xe Video
        bInterfaceSubClass :    0x2
        bInterfaceProtocol :    0x0
        iInterface         :    0x0 
        ENDPOINT 0x81: Isochronous IN ========================
        bLength          :    0x7 (7 bytes)
        bDescriptorType  :    0x5 Endpoint
        bEndpointAddress :   0x81 IN
        bmAttributes     :    0x5 Isochronous
        wMaxPacketSize   : 0x1320 (4896 bytes)
        bInterval        :    0x1
        INTERFACE 1, 6: Video ==================================
        bLength            :    0x9 (9 bytes)
        bDescriptorType    :    0x4 Interface
        bInterfaceNumber   :    0x1
        bAlternateSetting  :    0x6
        bNumEndpoints      :    0x1
        bInterfaceClass    :    0xe Video
        bInterfaceSubClass :    0x2
        bInterfaceProtocol :    0x0
        iInterface         :    0x0 
        ENDPOINT 0x81: Isochronous IN ========================
        bLength          :    0x7 (7 bytes)
        bDescriptorType  :    0x5 Endpoint
        bEndpointAddress :   0x81 IN
        bmAttributes     :    0x5 Isochronous
        wMaxPacketSize   : 0x1400 (5120 bytes)
        bInterval        :    0x1
        INTERFACE 2: Video =====================================
        bLength            :    0x9 (9 bytes)
        bDescriptorType    :    0x4 Interface
        bInterfaceNumber   :    0x2
        bAlternateSetting  :    0x0
        bNumEndpoints      :    0x0
        bInterfaceClass    :    0xe Video
        bInterfaceSubClass :    0x2
        bInterfaceProtocol :    0x0
        iInterface         :    0x0 
        INTERFACE 2, 1: Video ==================================
        bLength            :    0x9 (9 bytes)
        bDescriptorType    :    0x4 Interface
        bInterfaceNumber   :    0x2
        bAlternateSetting  :    0x1
        bNumEndpoints      :    0x1
        bInterfaceClass    :    0xe Video
        bInterfaceSubClass :    0x2
        bInterfaceProtocol :    0x0
        iInterface         :    0x0 
        ENDPOINT 0x82: Isochronous IN ========================
        bLength          :    0x7 (7 bytes)
        bDescriptorType  :    0x5 Endpoint
        bEndpointAddress :   0x82 IN
        bmAttributes     :    0x5 Isochronous
        wMaxPacketSize   :   0x80 (128 bytes)
        bInterval        :    0x1
        INTERFACE 2, 2: Video ==================================
        bLength            :    0x9 (9 bytes)
        bDescriptorType    :    0x4 Interface
        bInterfaceNumber   :    0x2
        bAlternateSetting  :    0x2
        bNumEndpoints      :    0x1
        bInterfaceClass    :    0xe Video
        bInterfaceSubClass :    0x2
        bInterfaceProtocol :    0x0
        iInterface         :    0x0 
        ENDPOINT 0x82: Isochronous IN ========================
        bLength          :    0x7 (7 bytes)
        bDescriptorType  :    0x5 Endpoint
        bEndpointAddress :   0x82 IN
        bmAttributes     :    0x5 Isochronous
        wMaxPacketSize   :  0x100 (256 bytes)
        bInterval        :    0x1
        INTERFACE 2, 3: Video ==================================
        bLength            :    0x9 (9 bytes)
        bDescriptorType    :    0x4 Interface
        bInterfaceNumber   :    0x2
        bAlternateSetting  :    0x3
        bNumEndpoints      :    0x1
        bInterfaceClass    :    0xe Video
        bInterfaceSubClass :    0x2
        bInterfaceProtocol :    0x0
        iInterface         :    0x0 
        ENDPOINT 0x82: Isochronous IN ========================
        bLength          :    0x7 (7 bytes)
        bDescriptorType  :    0x5 Endpoint
        bEndpointAddress :   0x82 IN
        bmAttributes     :    0x5 Isochronous
        wMaxPacketSize   :  0x320 (800 bytes)
        bInterval        :    0x1
        INTERFACE 2, 4: Video ==================================
        bLength            :    0x9 (9 bytes)
        bDescriptorType    :    0x4 Interface
        bInterfaceNumber   :    0x2
        bAlternateSetting  :    0x4
        bNumEndpoints      :    0x1
        bInterfaceClass    :    0xe Video
        bInterfaceSubClass :    0x2
        bInterfaceProtocol :    0x0
        iInterface         :    0x0 
        ENDPOINT 0x82: Isochronous IN ========================
        bLength          :    0x7 (7 bytes)
        bDescriptorType  :    0x5 Endpoint
        bEndpointAddress :   0x82 IN
        bmAttributes     :    0x5 Isochronous
        wMaxPacketSize   :  0xb20 (2848 bytes)
        bInterval        :    0x1
        INTERFACE 2, 5: Video ==================================
        bLength            :    0x9 (9 bytes)
        bDescriptorType    :    0x4 Interface
        bInterfaceNumber   :    0x2
        bAlternateSetting  :    0x5
        bNumEndpoints      :    0x1
        bInterfaceClass    :    0xe Video
        bInterfaceSubClass :    0x2
        bInterfaceProtocol :    0x0
        iInterface         :    0x0 
        ENDPOINT 0x82: Isochronous IN ========================
        bLength          :    0x7 (7 bytes)
        bDescriptorType  :    0x5 Endpoint
        bEndpointAddress :   0x82 IN
        bmAttributes     :    0x5 Isochronous
        wMaxPacketSize   : 0x1320 (4896 bytes)
        bInterval        :    0x1
        INTERFACE 2, 6: Video ==================================
        bLength            :    0x9 (9 bytes)
        bDescriptorType    :    0x4 Interface
        bInterfaceNumber   :    0x2
        bAlternateSetting  :    0x6
        bNumEndpoints      :    0x1
        bInterfaceClass    :    0xe Video
        bInterfaceSubClass :    0x2
        bInterfaceProtocol :    0x0
        iInterface         :    0x0 
        ENDPOINT 0x82: Isochronous IN ========================
        bLength          :    0x7 (7 bytes)
        bDescriptorType  :    0x5 Endpoint
        bEndpointAddress :   0x82 IN
        bmAttributes     :    0x5 Isochronous
        wMaxPacketSize   : 0x1400 (5120 bytes)
        bInterval        :    0x1
        INTERFACE 3: Audio =====================================
        bLength            :    0x9 (9 bytes)
        bDescriptorType    :    0x4 Interface
        bInterfaceNumber   :    0x3
        bAlternateSetting  :    0x0
        bNumEndpoints      :    0x0
        bInterfaceClass    :    0x1 Audio
        bInterfaceSubClass :    0x1
        bInterfaceProtocol :    0x0
        iInterface         :    0x4 Error Accessing String
        INTERFACE 4: Audio =====================================
        bLength            :    0x9 (9 bytes)
        bDescriptorType    :    0x4 Interface
        bInterfaceNumber   :    0x4
        bAlternateSetting  :    0x0
        bNumEndpoints      :    0x0
        bInterfaceClass    :    0x1 Audio
        bInterfaceSubClass :    0x2
        bInterfaceProtocol :    0x0
        iInterface         :    0x4 Error Accessing String
        INTERFACE 4, 1: Audio ==================================
        bLength            :    0x9 (9 bytes)
        bDescriptorType    :    0x4 Interface
        bInterfaceNumber   :    0x4
        bAlternateSetting  :    0x1
        bNumEndpoints      :    0x1
        bInterfaceClass    :    0x1 Audio
        bInterfaceSubClass :    0x2
        bInterfaceProtocol :    0x0
        iInterface         :    0x4 Error Accessing String
        ENDPOINT 0x84: Isochronous IN ========================
        bLength          :    0x9 (7 bytes)
        bDescriptorType  :    0x5 Endpoint
        bEndpointAddress :   0x84 IN
        bmAttributes     :    0x5 Isochronous
        wMaxPacketSize   :   0xc0 (192 bytes)
        bInterval        :    0x4
    [DEBUG FindCamera] Length of v4ctl : 32
    [DEBUG FindCamera] ID: /sys/bus/usb/devices/3-2


Lines:
    for i in range(len(v4ctl)):
        print(f"Looped v4ctl: {v4ctl[i]}")

Output:
    Looped v4ctl: pispbe (platform:1000880000.pisp_be):
    Looped v4ctl: 	/dev/video20
    Looped v4ctl: 	/dev/video21
    Looped v4ctl: 	/dev/video22
    Looped v4ctl: 	/dev/video23
    Looped v4ctl: 	/dev/video24
    Looped v4ctl: 	/dev/video25
    Looped v4ctl: 	/dev/video26
    Looped v4ctl: 	/dev/video27
    Looped v4ctl: 	/dev/video28
    Looped v4ctl: 	/dev/video29
    Looped v4ctl: 	/dev/video30
    Looped v4ctl: 	/dev/video31
    Looped v4ctl: 	/dev/video32
    Looped v4ctl: 	/dev/video33
    Looped v4ctl: 	/dev/video34
    Looped v4ctl: 	/dev/video35
    Looped v4ctl: 	/dev/media0
    Looped v4ctl: 	/dev/media2
    Looped v4ctl: 
    Looped v4ctl: rpivid (platform:rpivid):
    Looped v4ctl: 	/dev/video19
    Looped v4ctl: 	/dev/media1
    Looped v4ctl: 
    Looped v4ctl: Arducam USB Camera: Arducam USB (usb-xhci-hcd.1-2):
    Looped v4ctl: 	/dev/video0
    Looped v4ctl: 	/dev/video1
    Looped v4ctl: 	/dev/video2
    Looped v4ctl: 	/dev/video3
    Looped v4ctl: 	/dev/media3
    Looped v4ctl: 
    Looped v4ctl: 






